{
  "$schema": "../component.schema.json",
  "name": "button",
  "displayName": "Button",
  "description": "A versatile Vue SFC Button component with variants.",
  "version": "0.1.0",
  "frameworks": ["vue"],
  "files": ["Button.vue"],
  "tokens": {
    "requires": [
      "--ds-color-primary",
      "--ds-color-on-primary",
      "--ds-color-secondary",
      "--ds-color-on-secondary",
      "--ds-radius-md",
      "--ds-space-0_5",
      "--ds-space-1",
      "--ds-space-2",
      "--ds-space-3",
      "--ds-space-4",
      "--ds-space-5"
    ]
  },
  "dependencies": [],
  "peerDependencies": {
    "vue": "^3.0.0"
  },
  "install": {
    "path": "app/components/ui"
  }
}
